{
  "fixed_test_run_id": "exploratory_reversal_p98_irasym_w20_trainval_20260506",
  "run_id": "exploratory_reversal_p98_irasym_w20_trainval_20260506",
  "attempt_id": "attempt_20260506_130137",
  "generated_at": "2026-05-06T13:04:22.530324+08:00",
  "candidate_scheme_id": "reversal_p98_intraday_reversal_asymmetry_w20_v1",
  "research_round_id": "rr_exploratory_reversal_irasym_w20_20260506",
  "benchmark_code": "CSI_ALL_SHARE_TR",
  "benchmark_name": "中证全指全收益指数",
  "statistics_definition": "annual_relative_return follows framework appendix B.2/B.2B using effective benchmark-overlap days.",
  "perturbations": [
    {
      "topk": 8,
      "effective_relative_days": 4132,
      "annual_relative_return": 0.020843293829364562,
      "relative_ir": -0.054757225889107565
    },
    {
      "topk": 12,
      "effective_relative_days": 4132,
      "annual_relative_return": 0.020963806420054354,
      "relative_ir": -0.05450485734071392
    }
  ]
}
