{
  "fixed_test_run_id": "exploratory_raw_tail_p98_v1",
  "run_id": "exploratory_raw_tail_p98_v1",
  "attempt_id": "attempt_20260507_120236",
  "generated_at": "2026-05-07T12:05:09.961416+08:00",
  "candidate_scheme_id": "raw_tail_p98_v1",
  "research_round_id": "rr_exploratory_neut_tail_combo_20260506",
  "benchmark_code": "CSI_ALL_SHARE_TR",
  "benchmark_name": "中证全指全收益指数",
  "statistics_definition": "annual_relative_return follows framework appendix B.2/B.2B using effective benchmark-overlap days.",
  "perturbations": [
    {
      "topk": 8,
      "effective_relative_days": 4132,
      "annual_relative_return": -0.0016882713115772274,
      "relative_ir": -0.18130384108014166
    },
    {
      "topk": 12,
      "effective_relative_days": 4132,
      "annual_relative_return": -0.0008510854474259588,
      "relative_ir": -0.17689288229351435
    }
  ]
}
