{
  "fixed_test_run_id": "exploratory_fixed_test_alpha158_corr30_cord30_dual_signal_family_trainval_20260430",
  "run_id": "exploratory_alpha158_corr30_cord30_dual_signal_family_trainval_20260430",
  "attempt_id": "attempt_20260430_172624",
  "generated_at": "2026-04-30T17:34:51.980346+08:00",
  "candidate_scheme_id": "alpha158_corr30_cord30_dual_signal_family_v1",
  "research_round_id": "rr_alpha158_corr30_cord30_dual_signal_family_20260430",
  "benchmark_code": "CSI_ALL_SHARE_TR",
  "benchmark_name": "中证全指全收益指数",
  "statistics_definition": "annual_relative_return follows framework appendix B.2/B.2B using effective benchmark-overlap days.",
  "perturbations": [
    {
      "topk": 8,
      "effective_relative_days": 4132,
      "annual_relative_return": -0.05246955289095301,
      "relative_ir": -0.3941278711220947
    },
    {
      "topk": 12,
      "effective_relative_days": 4132,
      "annual_relative_return": -0.052087154992584206,
      "relative_ir": -0.3945269373627661
    }
  ]
}
