{
  "fixed_test_run_id": "fullchain_price_volume_liquidity_trend_60_120_substitution_20260423_153129",
  "run_id": "fullchain_price_volume_liquidity_trend_60_120_substitution_20260423_153129",
  "attempt_id": "attempt_20260423_153416",
  "generated_at": "2026-04-23T15:40:25.099728+08:00",
  "candidate_scheme_id": "price_volume_v21_liquidity_trend_60_120_substitution",
  "research_round_id": "rr_price_volume_liquidity_trend_60_120_substitution_family_20260423",
  "benchmark_code": "CSI_ALL_SHARE_TR",
  "benchmark_name": "中证全指全收益指数",
  "statistics_definition": "annual_relative_return follows framework appendix B.2/B.2B using effective benchmark-overlap days.",
  "perturbations": [
    {
      "topk": 8,
      "effective_relative_days": 5162,
      "annual_relative_return": -0.05258334827895783,
      "relative_ir": -0.4350341787623641
    },
    {
      "topk": 12,
      "effective_relative_days": 5162,
      "annual_relative_return": -0.052109148131675886,
      "relative_ir": -0.43500539695482837
    }
  ]
}
