{
  "fixed_test_run_id": "confirmatory_fixed_test_cord30_trainval_20260430_round4",
  "run_id": "confirmatory_cord30_trainval_20260430_round4",
  "attempt_id": "attempt_20260430_152950",
  "generated_at": "2026-04-30T15:33:23.047532+08:00",
  "candidate_scheme_id": "price_volume_single_signal_alpha158_cord30_v1",
  "research_round_id": "rr_confirmatory_alpha158_high_invested_weight_head_extraction_shortlist_round4_20260430",
  "benchmark_code": "CSI_ALL_SHARE_TR",
  "benchmark_name": "中证全指全收益指数",
  "statistics_definition": "annual_relative_return follows framework appendix B.2/B.2B using effective benchmark-overlap days.",
  "perturbations": [
    {
      "topk": 8,
      "effective_relative_days": 4132,
      "annual_relative_return": -0.027578486175353967,
      "relative_ir": -0.2907164782450677
    },
    {
      "topk": 12,
      "effective_relative_days": 4132,
      "annual_relative_return": -0.03126768261641699,
      "relative_ir": -0.3125287779011365
    }
  ]
}
