{
  "fixed_test_run_id": "confirmatory_fixed_test_vsumd60_seed_liquidity_guard70_trainval_20260429",
  "run_id": "confirmatory_vsumd60_seed_liquidity_guard70_trainval_20260429",
  "attempt_id": "attempt_20260429_151710",
  "generated_at": "2026-04-29T15:20:00.341519+08:00",
  "candidate_scheme_id": "confirmatory_alpha158_vsumd60_seed_liquidity_guard70_v1",
  "research_round_id": "rr_confirmatory_alpha158_vsumd60_family_seed_liquidity_guard_20260429",
  "benchmark_code": "CSI_ALL_SHARE_TR",
  "benchmark_name": "中证全指全收益指数",
  "statistics_definition": "annual_relative_return follows framework appendix B.2/B.2B using effective benchmark-overlap days.",
  "perturbations": [
    {
      "topk": 8,
      "effective_relative_days": 4132,
      "annual_relative_return": -0.08576424507122804,
      "relative_ir": -0.5826336097553321
    },
    {
      "topk": 12,
      "effective_relative_days": 4132,
      "annual_relative_return": -0.08676717137750989,
      "relative_ir": -0.5904679752706004
    }
  ]
}
