{
  "fixed_test_run_id": "confirmatory_reversal_p98_cord30_trainval_20260506",
  "run_id": "confirmatory_reversal_p98_cord30_trainval_20260506",
  "attempt_id": "attempt_20260506_115112",
  "generated_at": "2026-05-06T11:54:42.739259+08:00",
  "candidate_scheme_id": "reversal_p98_cord30_ew_v1",
  "research_round_id": "rr_confirmatory_reversal_cord30_promotion_20260506",
  "benchmark_code": "CSI_ALL_SHARE_TR",
  "benchmark_name": "中证全指全收益指数",
  "statistics_definition": "annual_relative_return follows framework appendix B.2/B.2B using effective benchmark-overlap days.",
  "perturbations": [
    {
      "topk": 8,
      "effective_relative_days": 4132,
      "annual_relative_return": 0.0017606875793603205,
      "relative_ir": -0.15850322433236963
    },
    {
      "topk": 12,
      "effective_relative_days": 4132,
      "annual_relative_return": 0.009156118510545541,
      "relative_ir": -0.12213260184170432
    }
  ]
}
