{
  "fixed_test_run_id": "confirmatory_reversal_p98_trainval_20260506",
  "run_id": "confirmatory_reversal_p98_trainval_20260506",
  "attempt_id": "attempt_20260506_114831",
  "generated_at": "2026-05-06T11:51:04.903378+08:00",
  "candidate_scheme_id": "reversal_tail_exclude_p98_v1",
  "research_round_id": "rr_confirmatory_reversal_cord30_promotion_20260506",
  "benchmark_code": "CSI_ALL_SHARE_TR",
  "benchmark_name": "中证全指全收益指数",
  "statistics_definition": "annual_relative_return follows framework appendix B.2/B.2B using effective benchmark-overlap days.",
  "perturbations": [
    {
      "topk": 8,
      "effective_relative_days": 4132,
      "annual_relative_return": -0.0016882713115773385,
      "relative_ir": -0.181303841080142
    },
    {
      "topk": 12,
      "effective_relative_days": 4132,
      "annual_relative_return": -0.0008510854474259588,
      "relative_ir": -0.1768928822935147
    }
  ]
}
