{
  "fixed_test_run_id": "exploratory_cohort5_c1_trendbias_only",
  "run_id": "exploratory_cohort5_c1_trendbias_only",
  "attempt_id": "attempt_20260501_125655",
  "generated_at": "2026-05-01T12:59:54.685496+08:00",
  "candidate_scheme_id": "exploratory_cohort5_c1_trendbias_only",
  "research_round_id": "rr_exploratory_intraday_cohort5_contract_design_20260501",
  "benchmark_code": "CSI_ALL_SHARE_TR",
  "benchmark_name": "中证全指全收益指数",
  "statistics_definition": "annual_relative_return follows framework appendix B.2/B.2B using effective benchmark-overlap days.",
  "perturbations": [
    {
      "topk": 8,
      "effective_relative_days": 4132,
      "annual_relative_return": 0.10569297806830025,
      "relative_ir": 0.631304055009983
    },
    {
      "topk": 12,
      "effective_relative_days": 4132,
      "annual_relative_return": 0.12061566262670609,
      "relative_ir": 0.722447343831565
    }
  ]
}
