{
  "fixed_test_run_id": "exploratory_p98_overnight_supplement_v2",
  "run_id": "exploratory_p98_overnight_supplement_v2",
  "attempt_id": "attempt_20260506_141738",
  "generated_at": "2026-05-06T14:19:56.892812+08:00",
  "candidate_scheme_id": "p98_overnight_supplement_v2",
  "research_round_id": "rr_exploratory_overnight_intraday_decomposition_20260506",
  "benchmark_code": "CSI_ALL_SHARE_TR",
  "benchmark_name": "中证全指全收益指数",
  "statistics_definition": "annual_relative_return follows framework appendix B.2/B.2B using effective benchmark-overlap days.",
  "perturbations": [
    {
      "topk": 8,
      "effective_relative_days": 4132,
      "annual_relative_return": -0.034254036625091966,
      "relative_ir": -0.34323199852276254
    },
    {
      "topk": 12,
      "effective_relative_days": 4132,
      "annual_relative_return": -0.029365037586967957,
      "relative_ir": -0.31938701975364014
    }
  ]
}
